{
  "$schema": "https://json-schema.org/draft/2020-12/schema",
  "$id": "https://unit-talk.dev/schemas/lane_manifest_v1.schema.json",
  "title": "Lane Manifest V1",
  "type": "object",
  "required": [
    "schema_version",
    "issue_id",
    "lane_type",
    "tier",
    "worktree_path",
    "branch",
    "base_branch",
    "commit_sha",
    "pr_url",
    "files_changed",
    "file_scope_lock",
    "expected_proof_paths",
    "status",
    "started_at",
    "heartbeat_at",
    "closed_at",
    "blocked_by",
    "preflight_token",
    "created_by",
    "truth_check_history",
    "reopen_history"
  ],
  "properties": {
    "schema_version": {
      "enum": [1, 2],
      "description": "1 = historical (pre-UTV2-1526 model-routing compatibility rework); 2 = current, written by createManifest for every newly created lane. This is the real Codex model-routing compatibility boundary -- NOT model_routing's presence/absence. See the allOf conditionals below and scripts/ops/shared.ts's LANE_MANIFEST_CURRENT_SCHEMA_VERSION doc comment."
    },
    "issue_id": {
      "type": "string",
      "pattern": "^(?:UTV2|WORK)-[0-9]+$",
      "description": "Repo-owned work identity, not a tracker key (tracker independence, ratified 2026-09-05). WORK-### is the repo-minted namespace for work with no tracker issue. KNOWN BOUND: merge-gate.yml, p0-protocol.yml and executor-result-validator.yml are reserved surfaces and still resolve a lane by UTV2-###, so a WORK-### lane is usable through closeout but is not yet mergeable."
    },
    "tracker_ref": {
      "type": ["string", "null"],
      "pattern": "^(?:UTV2|UNI)-[0-9]+$",
      "description": "The tracker (Linear) issue key for this lane, or null when the lane deliberately has no tracker issue, in which case every tracker-dependent preflight and truth-check gate SKIPS. ABSENT is not null: a manifest written before this field existed falls back to issue_id via resolveTrackerRef(), so historical lanes keep the behaviour they had. Optional and non-blocking by design."
    },
    "lane_type": { "enum": ["claude", "codex-cli", "codex-cloud"] },
    "executor": {
      "enum": ["claude", "codex-cli", "codex-cloud"],
      "description": "Distinct from lane_type in the current (post-canonical-lane-type) manifest shape; scripts/ops/shared.ts is authoritative for the exact relationship."
    },
    "tier": { "enum": ["T1", "T2", "T3"] },
    "worktree_path": { "type": "string" },
    "branch": { "type": "string" },
    "base_branch": { "const": "main" },
    "commit_sha": { "type": ["string", "null"] },
    "pr_url": { "type": ["string", "null"] },
    "files_changed": { "type": "array", "items": { "type": "string" } },
    "file_scope_lock": {
      "type": "array",
      "minItems": 1,
      "items": { "type": "string" }
    },
    "expected_proof_paths": {
      "type": "array",
      "items": { "type": "string" }
    },
    "status": {
      "enum": ["started", "in_progress", "in_review", "merged", "done", "blocked", "reopened"]
    },
    "started_at": { "type": "string", "format": "date-time" },
    "heartbeat_at": { "type": "string", "format": "date-time" },
    "closed_at": { "type": ["string", "null"], "format": "date-time" },
    "blocked_by": { "type": "array", "items": { "type": "string" } },
    "preflight_token": { "type": "string" },
    "created_by": { "enum": ["claude", "codex-cli", "pm"] },
    "truth_check_history": { "type": "array" },
    "reopen_history": { "type": "array" },
    "scope_release_history": {
      "type": "array",
      "description": "Append-only audit trail of narrowing-only file_scope_lock releases (UTV2-1762). Absent on lanes that never released a path. Each entry records exactly which paths left the lock, who released them, against which PR and exact head SHA, and the lock hash before and after. The previous_lock_hash -> resulting_lock_hash chain must terminate at the hash of the manifest's CURRENT file_scope_lock, which is what makes an unaudited edit to the lock detectable. Entries only ever describe removals; this field can never grant scope. See scripts/ops/scope-release.ts and LANE_MANIFEST_SPEC.md.",
      "items": {
        "type": "object",
        "required": [
          "released_at",
          "actor",
          "reason",
          "pr_number",
          "pr_url",
          "head_sha",
          "previous_lock_hash",
          "resulting_lock_hash",
          "released_paths",
          "verifications"
        ],
        "properties": {
          "released_at": { "type": "string", "format": "date-time" },
          "actor": { "type": "string", "minLength": 1 },
          "reason": { "type": "string", "minLength": 1 },
          "pr_number": { "type": "integer", "minimum": 1 },
          "pr_url": { "type": "string", "minLength": 1 },
          "head_sha": { "type": "string", "minLength": 1 },
          "previous_lock_hash": { "type": "string", "minLength": 1 },
          "resulting_lock_hash": { "type": "string", "minLength": 1 },
          "released_paths": {
            "type": "array",
            "minItems": 1,
            "items": { "type": "string", "minLength": 1 }
          },
          "verifications": {
            "type": "array",
            "minItems": 1,
            "items": {
              "type": "object",
              "required": ["check", "status", "detail"],
              "properties": {
                "check": { "type": "string", "minLength": 1 },
                "status": { "const": "pass" },
                "detail": { "type": "string" }
              }
            }
          }
        }
      }
    },
    "p0_protocol": {
      "type": "object",
      "description": "P0 Runtime Hardening merge protocol fields (UTV2-948). Set when the lane's issue is in the P0 project. Truth-check H-checks consume these fields.",
      "required": ["required"],
      "properties": {
        "required": { "type": "boolean" },
        "codex_implementation": {
          "type": "object",
          "properties": {
            "recorded": { "type": "boolean" },
            "pr_url": { "type": "string" }
          },
          "required": ["recorded"],
          "additionalProperties": false
        },
        "claude_critique": {
          "type": "object",
          "properties": {
            "recorded": { "type": "boolean" },
            "artifact_path": { "type": "string" }
          },
          "required": ["recorded"],
          "additionalProperties": false
        },
        "human_approval": {
          "type": "object",
          "properties": {
            "recorded": { "type": "boolean" },
            "pm_verdict_url": { "type": "string" }
          },
          "required": ["recorded"],
          "additionalProperties": false
        },
        "runtime_verification": {
          "type": "object",
          "properties": {
            "recorded": { "type": "boolean" },
            "artifact_path": { "type": "string" },
            "result": { "enum": ["pass", "fail"] }
          },
          "required": ["recorded"],
          "additionalProperties": false
        },
        "merge_type": { "enum": ["manual", "auto", null] }
      },
      "additionalProperties": false
    },
    "model_routing": {
      "type": "object",
      "description": "Deterministic Codex model-profile decision (UTV2-1526). Codex-only. Required on a schema_version-2 Codex-executor manifest (deleting it fails validation); optional/legacy on schema_version-1; forbidden on any Claude-executor manifest. See docs/05_operations/policies/codex-model-routing.json.",
      "required": ["profile", "model", "reasoning_effort", "selected_by", "policy_version"],
      "properties": {
        "profile": { "type": "string" },
        "model": { "type": "string" },
        "reasoning_effort": { "type": "string" },
        "selected_by": { "enum": ["three-brain", "manual-override"] },
        "policy_version": { "type": "string" },
        "legacy_resolved": { "type": "boolean" },
        "override": {
          "type": "object",
          "required": ["authorized_by", "reason"],
          "properties": {
            "authorized_by": { "type": "string" },
            "reason": { "type": "string" },
            "at": { "type": "string" },
            "declared": {
              "type": "object",
              "description": "Written only by `ops:lane-manifest reconcile-routing` (WORK-2026102902): the routing the lane declared at lane-start, before it was reconciled to the model its session actually ran.",
              "required": ["profile", "model", "reasoning_effort", "selected_by"],
              "properties": {
                "profile": { "type": "string" },
                "model": { "type": "string" },
                "reasoning_effort": { "type": "string" },
                "selected_by": { "type": "string" }
              },
              "additionalProperties": false
            }
          },
          "additionalProperties": false
        }
      },
      "additionalProperties": false
    },
    "verification_target": {
      "type": "string",
      "pattern": "^UTV2-[0-9]+$",
      "description": "The UTV2-### issue this verification lane produces proof for (UTV2-1533). Required on a schema_version-2 lane_type:\"verification\" manifest (deleting it fails validation); optional/legacy on schema_version-1; forbidden on any other lane_type, at any schema version. Backs the per-target Verification concurrency cap in docs/governance/CONCURRENCY_CONFIG.json's type_caps.verification.max_per_target."
    }
  },
  "additionalProperties": true,
  "allOf": [
    {
      "description": "schema_version 2 + Codex executor requires model_routing (the deletion-attack fix from PM review finding #2 -- this is documentation of the same rule scripts/ops/shared.ts#validateManifest enforces at runtime; this JSON schema is not itself run through an AJV validator anywhere in this repo today).",
      "if": {
        "properties": {
          "schema_version": { "const": 2 },
          "executor": { "enum": ["codex-cli", "codex-cloud"] }
        },
        "required": ["schema_version", "executor"]
      },
      "then": { "required": ["model_routing"] }
    },
    {
      "description": "A Claude-executor manifest must never carry model_routing, at any schema version.",
      "if": {
        "properties": { "executor": { "const": "claude" } },
        "required": ["executor"]
      },
      "then": { "not": { "required": ["model_routing"] } }
    },
    {
      "description": "schema_version 2 + lane_type:verification requires verification_target (UTV2-1533 P2 fix -- same deletion-attack shape as model_routing above; scripts/ops/shared.ts#validateManifest enforces this at runtime, this schema documents it).",
      "if": {
        "properties": {
          "schema_version": { "const": 2 },
          "lane_type": { "const": "verification" }
        },
        "required": ["schema_version", "lane_type"]
      },
      "then": { "required": ["verification_target"] }
    },
    {
      "description": "A non-verification-type manifest must never carry verification_target, at any schema version.",
      "if": {
        "not": {
          "properties": { "lane_type": { "const": "verification" } },
          "required": ["lane_type"]
        }
      },
      "then": { "not": { "required": ["verification_target"] } }
    }
  ]
}
