{
  "schema_version": 1,
  "issue_id": "UTV2-570",
  "lane_type": "claude",
  "tier": "T2",
  "worktree_path": "C:/Dev/Unit-Talk-v2-main",
  "branch": "claude/utv2-570-routing-explanation-block",
  "base_branch": "main",
  "commit_sha": null,
  "pr_url": null,
  "files_changed": [],
  "file_scope_lock": [
    "apps/operator-web/src",
    "apps/api/src"
  ],
  "expected_proof_paths": [],
  "status": "merged",
  "started_at": "2026-04-21T08:52:00.000Z",
  "heartbeat_at": "2026-04-21T09:06:47.000Z",
  "closed_at": "2026-04-21T09:06:47.000Z",
  "blocked_by": [],
  "preflight_token": "dispatch-auto",
  "created_by": "claude",
  "truth_check_history": [],
  "reopen_history": []
}