{
  "schema_version": 1,
  "issue_id": "UTV2-883",
  "lane_type": "claude",
  "tier": "T2",
  "worktree_path": ".",
  "branch": "claude/utv2-883-dual-participant-consolidation",
  "base_branch": "main",
  "commit_sha": "b240ca1b",
  "pr_url": "https://github.com/griff843/Unit-Talk-v2/pull/638",
  "files_changed": [
    ".ops/sync.yml",
    "apps/api/src/database-smoke.test.ts",
    "apps/api/src/index.ts",
    "apps/api/src/market-universe-materializer.ts",
    "docs/06_status/lanes/UTV2-883.json",
    "supabase/migrations/202605120001_utv2_883_link_market_universe_participant_ids.sql"
  ],
  "file_scope_lock": [
    "supabase/migrations/**",
    "apps/api/src/**"
  ],
  "expected_proof_paths": [],
  "status": "in_review",
  "started_at": "2026-05-12T05:25:45.620Z",
  "heartbeat_at": "2026-05-12T05:25:45.620Z",
  "closed_at": null,
  "blocked_by": [],
  "preflight_token": "dispatch-auto",
  "created_by": "claude",
  "truth_check_history": [],
  "reopen_history": []
}
