{
  "schema_version": 1,
  "issue_id": "UTV2-579",
  "lane_type": "claude",
  "tier": "T2",
  "worktree_path": "C:\\Dev\\Unit-Talk-v2-main\\.out\\worktrees\\griffadavi__utv2-579-audit-blocker-add-live-freshness-and-stage-proof-checks-for",
  "branch": "griffadavi/utv2-579-audit-blocker-add-live-freshness-and-stage-proof-checks-for",
  "base_branch": "main",
  "commit_sha": "a6c0ad4",
  "pr_url": "https://github.com/griff843/Unit-Talk-v2/pull/331",
  "files_changed": [
    "scripts/stage-freshness-checks.ts",
    "package.json"
  ],
  "file_scope_lock": [
    "package.json"
  ],
  "expected_proof_paths": [
    "docs/06_status/proof/UTV2-579/diff-summary.md",
    "docs/06_status/proof/UTV2-579/verification.md"
  ],
  "status": "done",
  "started_at": "2026-04-15T18:29:56.380Z",
  "heartbeat_at": "2026-04-15T18:45:00.000Z",
  "closed_at": "2026-04-15T18:45:00.000Z",
  "blocked_by": [],
  "preflight_token": ".out/ops/preflight/griffadavi/utv2-579-audit-blocker-add-live-freshness-and-stage-proof-checks-for.json",
  "created_by": "claude",
  "truth_check_history": [],
  "reopen_history": []
}
