{
  "schema_version": 1,
  "issue_id": "UTV2-580",
  "lane_type": "claude",
  "tier": "T2",
  "worktree_path": "C:\\Dev\\Unit-Talk-v2-main\\.out\\worktrees\\griffadavi__utv2-580-audit-blocker-score-provenance-coverage",
  "branch": "griffadavi/utv2-580-audit-blocker-score-provenance-coverage",
  "base_branch": "main",
  "commit_sha": null,
  "pr_url": "https://github.com/griff843/Unit-Talk-v2/pull/310",
  "files_changed": [],
  "file_scope_lock": [
    "docs/05_operations/SCORE_PROVENANCE_STANDARD.md"
  ],
  "expected_proof_paths": [
    "docs/06_status/proof/UTV2-580/diff-summary.md",
    "docs/06_status/proof/UTV2-580/verification.md"
  ],
  "status": "done",
  "started_at": "2026-04-15T08:12:32.866Z",
  "heartbeat_at": "2026-04-15T18:20:00.000Z",
  "closed_at": "2026-04-15T18:20:00.000Z",
  "blocked_by": [],
  "preflight_token": ".out/ops/preflight/griffadavi/utv2-580-audit-blocker-score-provenance-coverage.json",
  "created_by": "claude",
  "truth_check_history": [],
  "reopen_history": []
}
