{
  "schema_version": 1,
  "issue_id": "UTV2-624",
  "lane_type": "claude",
  "tier": "T1",
  "worktree_path": "C:\\Dev\\Unit-Talk-v2-main\\.out\\worktrees\\griffadavi__utv2-624-modeling-gap-challenger-pipeline",
  "branch": "griffadavi/utv2-624-modeling-gap-challenger-pipeline",
  "base_branch": "main",
  "commit_sha": null,
  "pr_url": null,
  "files_changed": [],
  "file_scope_lock": [
    "docs/05_operations/CHALLENGER_PIPELINE_STANDARD.md"
  ],
  "expected_proof_paths": [
    "docs/06_status/proof/UTV2-624/evidence.json"
  ],
  "status": "started",
  "started_at": "2026-04-15T08:12:28.187Z",
  "heartbeat_at": "2026-04-15T08:12:28.187Z",
  "closed_at": null,
  "blocked_by": [],
  "preflight_token": ".out/ops/preflight/griffadavi/utv2-624-modeling-gap-challenger-pipeline.json",
  "created_by": "claude",
  "truth_check_history": [],
  "reopen_history": []
}
