{
  "schema_version": 1,
  "issue_id": "UTV2-912",
  "lane_type": "claude",
  "tier": "T2",
  "worktree_path": "C:/Dev/Unit-Talk-v2-main",
  "branch": "claude/utv2-912-market-type-id-null-fix",
  "base_branch": "main",
  "commit_sha": "652b16e2a80873a05744fafdba9103b0a5e85315",
  "pr_url": "https://github.com/griff843/Unit-Talk-v2/pull/671",
  "files_changed": [
    "supabase/migrations/202605140001_utv2_912_market_type_id_alias_backfill.sql"
  ],
  "file_scope_lock": [
    "apps/api/src/candidate-scoring-service.ts",
    "supabase/migrations/202605140001_utv2_912_market_type_id_alias_backfill.sql"
  ],
  "expected_proof_paths": [
    "docs/06_status/proof/UTV2-912/diff-summary.md",
    "docs/06_status/proof/UTV2-912/verification-log.md"
  ],
  "status": "done",
  "started_at": "2026-05-14T21:40:00.000Z",
  "heartbeat_at": "2026-05-15T03:45:48.375Z",
  "closed_at": "2026-05-15T03:46:00.000Z",
  "blocked_by": [],
  "preflight_token": "dispatch-auto",
  "created_by": "claude",
  "truth_check_history": [
    {
      "checked_at": "2026-05-15T03:41:40.119Z",
      "verdict": "fail",
      "merge_sha": "652b16e2a80873a05744fafdba9103b0a5e85315",
      "failures": [
        "M7",
        "P11",
        "P12",
        "S1"
      ],
      "runner": "manual"
    },
    {
      "checked_at": "2026-05-15T03:45:48.375Z",
      "verdict": "pass",
      "merge_sha": "652b16e2a80873a05744fafdba9103b0a5e85315",
      "failures": [],
      "runner": "manual"
    }
  ],
  "reopen_history": []
}
